{
  "schema_version": "event-geometry-sample-v1",
  "sample_id": "example:transition1x-endpoint",
  "task_mode": "endpoint_geometry",
  "source": {
    "dataset": "Transition1x-example",
    "revision": "illustrative",
    "raw_record_id": "example-0",
    "raw_sha256": null,
    "parent_calculation_ids": [],
    "source_group_id": null,
    "family_id": null,
    "family_evidence": "unknown",
    "split_manifest_sha256": null
  },
  "atoms": {
    "atomic_numbers": [
      6,
      8,
      1,
      1,
      8,
      1,
      1
    ],
    "isotopes": [
      null,
      null,
      null,
      null,
      null,
      null,
      null
    ],
    "map_ids": [
      1,
      2,
      3,
      4,
      5,
      6,
      7
    ],
    "stereo": [
      null,
      null,
      null,
      null,
      null,
      null,
      null
    ],
    "coordinate_unit": "angstrom"
  },
  "condition": {
    "current_graph": {
      "value": null,
      "status": "unknown",
      "source_ref": null
    },
    "formal_charge": {
      "value": null,
      "status": "unknown",
      "source_ref": null
    },
    "multiplicity": {
      "value": null,
      "status": "unknown",
      "source_ref": null
    },
    "microstate": {
      "value": null,
      "status": "unknown",
      "source_ref": null
    },
    "input_coordinates": {
      "value": {
        "reactant": "npz:r",
        "product": "npz:p"
      },
      "status": "observed",
      "source_ref": "example:declared-endpoint"
    },
    "coordinate_provenance": {
      "role": "declared_endpoint",
      "selected_by_reference": null
    },
    "solvent_membership": [],
    "known_condition": {
      "permission_mode": "declared_endpoints",
      "already_given_variables": [
        "reactant_coordinates",
        "product_coordinates",
        "endpoint_coordinates"
      ],
      "variables_to_infer": [
        "ts_geometry",
        "event_identity",
        "active_solvent_ids"
      ],
      "product_coordinates": {
        "value": {
          "ref": "npz:p"
        },
        "status": "observed",
        "source_ref": "example:declared-endpoint"
      },
      "reactive_atom_indices": [
        0,
        1
      ]
    }
  },
  "variables": {
    "known": [
      "reactant_coordinates",
      "product_coordinates",
      "endpoint_coordinates"
    ],
    "unknown": [
      "ts_geometry",
      "event_identity",
      "active_solvent_ids"
    ],
    "prediction_targets": [
      "ts_geometry"
    ]
  },
  "candidate_pool": {
    "generator_revision": null,
    "uses_reference_labels": false,
    "enumeration_attempts": null,
    "pre_cap_count": null,
    "event_cap": 32,
    "truncated": null,
    "events": []
  },
  "geometry": {
    "candidate_geometry_source": "declared_endpoint",
    "coordinates_ref": {
      "value": {
        "reactant": "npz:r",
        "product": "npz:p"
      },
      "status": "observed",
      "source_ref": "example:declared-endpoint"
    },
    "geometry_validity": {
      "value": null,
      "status": "unknown",
      "source_ref": null
    }
  },
  "labels": {
    "references": [],
    "competing_channel_coverage": "unknown",
    "physical_negative_labels_available": false
  },
  "gate": {
    "geometry_only": "pass",
    "event_geometry_matched": "blocked",
    "independent_evaluation": "blocked",
    "failure_reasons": [
      "illustrative schema example"
    ]
  }
}
