{
  "schema_version": "event-geometry-sample-v1",
  "sample_id": "example:endpoint-microsequence",
  "task_mode": "endpoint_microsequence_geometry",
  "source": {
    "dataset": "FlowER-example",
    "revision": "illustrative",
    "raw_record_id": "example-step",
    "raw_sha256": null,
    "parent_calculation_ids": [],
    "source_group_id": "numeric-0",
    "family_id": null,
    "family_evidence": "unknown",
    "split_manifest_sha256": null
  },
  "atoms": {
    "atomic_numbers": [
      6,
      8,
      1,
      1,
      8,
      1,
      1
    ],
    "isotopes": [
      null,
      null,
      null,
      null,
      null,
      null,
      null
    ],
    "map_ids": [
      1,
      2,
      3,
      4,
      5,
      6,
      7
    ],
    "stereo": [
      null,
      null,
      null,
      null,
      null,
      null,
      null
    ],
    "coordinate_unit": "angstrom"
  },
  "condition": {
    "current_graph": {
      "value": {
        "format": "mapped_cxsmiles"
      },
      "status": "observed",
      "source_ref": "example:flower-state"
    },
    "formal_charge": {
      "value": {
        "per_atom": true
      },
      "status": "observed",
      "source_ref": "example:flower-state"
    },
    "multiplicity": {
      "value": null,
      "status": "unknown",
      "source_ref": null
    },
    "microstate": {
      "value": null,
      "status": "unknown",
      "source_ref": null
    },
    "input_coordinates": {
      "value": null,
      "status": "unavailable",
      "source_ref": "example:no-3d"
    },
    "coordinate_provenance": {
      "role": "unavailable",
      "selected_by_reference": null
    },
    "solvent_membership": [],
    "known_condition": {
      "permission_mode": "full_mapped_product",
      "already_given_variables": [
        "current_graph",
        "formal_charge",
        "full_mapped_product"
      ],
      "variables_to_infer": [
        "event_order",
        "intermediate_states",
        "active_solvent_ids",
        "ts_geometry"
      ],
      "product_graph": {
        "value": {
          "format": "mapped_cxsmiles"
        },
        "status": "observed",
        "source_ref": "example:label-side"
      },
      "product_coordinates": {
        "value": null,
        "status": "unavailable",
        "source_ref": "example:no-3d"
      },
      "reactive_atom_indices": [
        0,
        1
      ]
    }
  },
  "variables": {
    "known": [
      "current_graph",
      "formal_charge",
      "full_mapped_product"
    ],
    "unknown": [
      "event_order",
      "intermediate_states",
      "active_solvent_ids",
      "ts_geometry"
    ],
    "prediction_targets": [
      "event_order",
      "intermediate_states",
      "ts_geometry"
    ]
  },
  "candidate_pool": {
    "generator_revision": null,
    "uses_reference_labels": false,
    "enumeration_attempts": null,
    "pre_cap_count": null,
    "event_cap": 32,
    "truncated": null,
    "events": []
  },
  "geometry": {
    "candidate_geometry_source": "generated_candidate",
    "coordinates_ref": {
      "value": null,
      "status": "unavailable",
      "source_ref": "example:no-3d"
    },
    "geometry_validity": {
      "value": null,
      "status": "unknown",
      "source_ref": null
    }
  },
  "labels": {
    "references": [],
    "competing_channel_coverage": "unknown",
    "physical_negative_labels_available": false
  },
  "gate": {
    "geometry_only": "blocked",
    "event_geometry_matched": "blocked",
    "independent_evaluation": "blocked",
    "failure_reasons": [
      "FlowER has no matched 3D geometry/environment labels"
    ]
  }
}
